{
  "schema_version": "0.1.8",
  "run_id": "e70bdf0d-c92b-49c3-b2de-106dc5034079",
  "reference_period": "2026-02",
  "created_at": "2026-03-22T22:33:02.460972Z",
  "status": "PASS_WITH_WARNING",
  "hard_checks": [
    {
      "check_id": "DMI_OUTPUT_ALL_QUINTILES_PRESENT",
      "status": "PASS",
      "message": "All 5 quintiles present in output"
    },
    {
      "check_id": "DMI_VALUES_REASONABLE_RANGE",
      "status": "PASS",
      "message": "All DMI values in [0, 100]: range 6.73 to 7.01",
      "metrics": {
        "min": 6.731927403009182,
        "max": 7.009919860204779
      }
    },
    {
      "check_id": "INFLATION_VALUES_PRESENT",
      "status": "PASS",
      "message": "Inflation computed for all quintiles: range 2.33% to 2.61%",
      "metrics": {
        "min": 2.331927403009182,
        "max": 2.609919860204779
      }
    },
    {
      "check_id": "CPI_CATEGORY_COVERAGE_COMPLETE",
      "status": "PASS",
      "message": "All 8 CPI categories present at t=2026-02",
      "metrics": {
        "categories_count": 8
      }
    },
    {
      "check_id": "WEIGHTS_SUM_TO_ONE",
      "status": "PASS",
      "message": "All quintile weights sum to 1.0 \u00b1 0.001"
    }
  ],
  "soft_checks": [
    {
      "check_id": "DMI_DISTRIBUTIONAL_GRADIENT",
      "status": "PASS",
      "message": "Expected pattern: Q1 (7.01) >= Q5 (6.73)",
      "metrics": {
        "q1_dmi": 7.009919860204779,
        "q5_dmi": 6.731927403009182,
        "difference": 0.2779924571955972
      }
    },
    {
      "check_id": "WEIGHTS_VINTAGE_AGE",
      "status": "WARN",
      "message": "Weights vintage age: 3 years (>2 years old, consider updating)",
      "metrics": {
        "weights_year": 2023,
        "reference_year": 2026,
        "age": 3
      }
    }
  ],
  "policy_gates": [
    {
      "gate_id": "CE_WEIGHTS_CONSERVATIVE_POLICY",
      "status": "WARN",
      "policy_ref": "ce_weights_policy_v0_1.json",
      "decision": {
        "weights_year": 2023,
        "reference_year": 2026,
        "is_current": false
      },
      "message": "Using 2023 weights for 2026 data (outdated - review needed)"
    }
  ],
  "warnings": [
    "Weights vintage age: 3 years (>2 years old, consider updating)",
    "Using 2023 weights for 2026 data (outdated - review needed)"
  ],
  "errors": [],
  "summary": {
    "hard_fail_count": 0,
    "soft_warn_count": 1,
    "policy_fail_count": 0
  }
}