{
  "schema_version": "0.1.8",
  "run_id": "b4802e83-f77c-4496-98fa-b0344df76277",
  "reference_period": "2024-11",
  "created_at": "2025-12-18T02:56:04.030375Z",
  "status": "PASS",
  "hard_checks": [
    {
      "check_id": "DMI_OUTPUT_ALL_QUINTILES_PRESENT",
      "status": "PASS",
      "message": "All 5 quintiles present in output"
    },
    {
      "check_id": "DMI_VALUES_REASONABLE_RANGE",
      "status": "PASS",
      "message": "All DMI values in [0, 100]: range 6.62 to 6.85",
      "metrics": {
        "min": 6.615173443121543,
        "max": 6.852988387991728
      }
    },
    {
      "check_id": "INFLATION_VALUES_PRESENT",
      "status": "PASS",
      "message": "Inflation computed for all quintiles: range 2.42% to 2.65%",
      "metrics": {
        "min": 2.4151734431215433,
        "max": 2.652988387991728
      }
    },
    {
      "check_id": "CPI_CATEGORY_COVERAGE_COMPLETE",
      "status": "PASS",
      "message": "All 8 CPI categories present at t=2024-11",
      "metrics": {
        "categories_count": 8
      }
    },
    {
      "check_id": "WEIGHTS_SUM_TO_ONE",
      "status": "PASS",
      "message": "All quintile weights sum to 1.0 \u00b1 0.001"
    }
  ],
  "soft_checks": [
    {
      "check_id": "DMI_DISTRIBUTIONAL_GRADIENT",
      "status": "PASS",
      "message": "Expected pattern: Q1 (6.85) >= Q5 (6.62)",
      "metrics": {
        "q1_dmi": 6.852988387991728,
        "q5_dmi": 6.615173443121543,
        "difference": 0.23781494487018495
      }
    },
    {
      "check_id": "WEIGHTS_VINTAGE_AGE",
      "status": "PASS",
      "message": "Weights vintage age: 1 years (acceptable)",
      "metrics": {
        "weights_year": 2023,
        "reference_year": 2024,
        "age": 1
      }
    }
  ],
  "policy_gates": [
    {
      "gate_id": "CE_WEIGHTS_CONSERVATIVE_POLICY",
      "status": "PASS",
      "policy_ref": "ce_weights_policy_v0_1.json",
      "decision": {
        "weights_year": 2023,
        "reference_year": 2024,
        "is_current": true
      },
      "message": "Using 2023 weights for 2024 data (current)"
    }
  ],
  "warnings": [],
  "errors": [],
  "summary": {
    "hard_fail_count": 0,
    "soft_warn_count": 0,
    "policy_fail_count": 0
  }
}